asin,title,price,rating,reviews,sold_past_month,is_bestseller,is_prime,is_amazon_choice,has_sustainability_features,brand
B0DJK7NW1J,"15.6 Inch Laptops, Windows 11 Laptop Computers with 4GB RAM 128GB SSD, Celeron N5095 Quad-Core CPU(Up to 2.9GHz), 1 Year Office 365, 180 ° Hinge, WiFi 6, 7000mAh, USB 3.2 * 3, HDMI, Type-C",199.98,4.4 out of 5 stars,48.0,100.0,False,False,False,False,Generic
B0BS4BP8FB,"Acer Aspire 3 A315-24P-R7VH Slim Laptop | 15.6"" Full HD IPS Display | AMD Ryzen 3 7320U Quad-Core Processor | AMD Radeon Graphics | 8GB LPDDR5 | 128GB NVMe SSD | Wi-Fi 6 | Windows 11 Home in S Mode",279.99,4.4 out of 5 stars,39243.0,8000.0,False,False,True,False,Acer
B0DKDY78K3,"Newest Gaming Laptop, Laptop with AMD Ryzen 7 5825U (8C/16T, Up to 4.5GHz), 16GB RAM 512GB NVMe SSD Laptop Computer, Radeon RX Vega 8 Graphics, 16.1-inch FHD Display, WiFi 6, 53Wh Battery, Backlit KB",649.99,4.8 out of 5 stars,18.0,100.0,False,False,False,False,Generic
B0CPL25J3W,"HP Portable Laptop, Student and Business, 14"" HD Display, Intel Quad-Core N4120, 8GB DDR4 RAM, 64GB eMMC, 1 Year Office 365, Webcam, RJ-45, HDMI, Wi-Fi, Windows 11 Home, Silver",197.35,4.1 out of 5 stars,1678.0,1000.0,False,False,False,False,HP
B0947BJ67M,"HP 14 Laptop, Intel Celeron N4020, 4 GB RAM, 64 GB Storage, 14-inch Micro-edge HD Display, Windows 11 Home, Thin & Portable, 4K Graphics, One Year of Microsoft 365 (14-dq0040nr, Snowflake White)",176.0,4.0 out of 5 stars,1861.0,4000.0,False,False,False,False,HP
B0B2D77YB8,"HP Newest 14"" Ultral Light Laptop for Students and Business, Intel Quad-Core N4120, 8GB RAM, 192GB Storage(64GB eMMC+128GB Micro SD), 1 Year Office 365, Webcam, HDMI, WiFi, USB-A&C, Win 11 S",249.99,4.0 out of 5 stars,1950.0,2000.0,False,False,False,False,HP
B0DK9HYLFP,"ACEMAGIC Laptop, Newest Windows 11 Laptop Computer,16GB DDR4 512GB SSD Gaming Laptop, Quad-Core N95 Processor, 15.6"" IPS 1080P PC,180° Open Angle,Long Battery Life,Metal Shell,WiFi,USB3.2, Type C",359.99,4.8 out of 5 stars,24.0,100.0,False,False,False,False,ACEMAGIC
B0DHXKL1BF,"HP Flagship 14"" Laptop with 1 Year Office 365 | 16GB RAM | 1.28TB Storage(128GB EMMC & 160GB Docking Station & 1TB Cloud Storage) | Intel 4-Core Processor | Webcam| Silver | Windows 11",339.0,4.3 out of 5 stars,13.0,100.0,False,False,False,False,HP
B09YRY6QCX,ASUS E410 Intel Celeron N4020 4GB 64GB 14-Inch HD LED Win 10 Laptop (Star Black),147.0,4.1 out of 5 stars,678.0,500.0,False,False,False,False,ASUS
B0CZKPF2QH,"HP Stream 14"" HD BrightView Laptop, Intel Celeron N4120, 16GB RAM, 288GB Storage (128GB eMMC + 160GB Docking Station Set), Intel UHD Graphics, 720p Webcam, Wi-Fi, 1 Year Office 365, Win 11 S, Silver",309.0,4.3 out of 5 stars,1986.0,500.0,False,False,False,False,HP
B0C3RNRB8W,"HP 17 Laptop, 17.3” HD+ Display, 11th Gen Intel Core i3-1125G4 Processor, 32GB RAM, 1TB SSD, Wi-Fi, HDMI, Webcam, Windows 11 Home, Silver",475.0,4.2 out of 5 stars,1585.0,1000.0,False,False,False,False,HP
B0CBJ46QZX,"Lenovo Newest Flagship Chromebook, 14'' FHD Touchscreen Slim Thin Light Laptop Computer, 8-Core MediaTek Kompanio 520 Processor, 4GB RAM, 64GB eMMC, WiFi 6,Chrome OS+HubxcelAccesory, Abyss Blue",206.99,4.3 out of 5 stars,497.0,2000.0,False,False,False,False,Lenovo
B0D9K758B1,"HP 15.6"" Portable Laptop (Include 1 Year Microsoft 365), HD Display, Intel Quad-Core N200 Processor, 16GB RAM, 128GB Storage, Wi-Fi 6, Webcam, HDMI, Numeric Keypad, Windows 11 Home, Black",286.95,4.1 out of 5 stars,675.0,400.0,False,False,False,False,HP
B0BZ8X9HGT,"HP Notebook Laptop, 15.6"" HD Touchscreen, Intel Core i3-1115G4 Processor, 32GB RAM, 1TB PCIe SSD, Webcam, Type-C, HDMI, SD Card Reader, Wi-Fi, Windows 11 Home, Silver",404.97,4.1 out of 5 stars,1010.0,1000.0,False,False,False,False,HP
B0CLHCWNV8,"ASUS Vivobook Laptop, 14"" FHD Display, i3-1215U, 16GB RAM, 512GB SSD, Wi-Fi 6, HDMI, Webcam, Touchpad, Windows 11 Home, Blue",310.0,4.3 out of 5 stars,35.0,400.0,False,False,False,False,ASUS
B0DKDV6QS6,"ACEMAGIC 2024 Newest 17.3Inch Laptop,FHD Display Laptop with Quad Core-12th Alder Lake N97(Up to 3.6GHz), 6000Mah Battery,16GB RAM 512GB ROM Business Laptop Computer.",399.99,4.3 out of 5 stars,12.0,200.0,False,False,False,False,ACEMAGIC
B0CMRGBXM9,"Acer Nitro V Gaming Laptop | Intel Core i7-13620H Processor | NVIDIA GeForce RTX 4050 Laptop GPU | 15.6"" FHD IPS 144Hz Display | 16GB DDR5 | 512GB Gen 4 SSD | WiFi 6 | Backlit KB | ANV15-51-73B9",799.99,4.4 out of 5 stars,360.0,1000.0,False,False,False,False,Acer
B0CV5ZSR17,"Acer Aspire Go 15 Slim Laptop | 15.6"" Full HD IPS 1080P Display | Intel Core i3-N305| Intel UHD Graphics | 8GB LPDDR5 | 128GB HD | Wi-Fi 6 | AI PC | Windows 11 Home in S Mode | AG15-31P-3947",269.99,4.2 out of 5 stars,1331.0,1000.0,False,False,False,True,Acer
B0D262TPSM,"Dell 15 15.6"" FHD 120Hz Business Laptop Computer, 12th Gen Intel 10-Core i5-1235U (Beat i7-1195G7), 32GB DDR4 RAM, 1TB PCIe SSD, 802.11ac WiFi, Bluetooth, Carbon Black, Windows 11 Pro",530.1,4.3 out of 5 stars,25.0,,False,False,False,False,Dell
B0CT4HX4T9,"Lined Spiral Journal Notebook for Women & Men, 140 Pages, College Ruled Hardcover Notebook for Work & Note Taking, Journals for Writing, A5(6""x8"") - Green",5.99,4.7 out of 5 stars,1158.0,10000.0,False,False,True,True,Generic
B003O2RXUQ,"Five Star Spiral Notebook + Study App, 5 Subject, College Ruled Paper, Fights Ink Bleed, Water Resistant Cover, 8-1/2"" x 11"", 200 Sheets, Black (72081)",5.68,4.8 out of 5 stars,30479.0,7000.0,True,False,False,False,Generic
B00D3OR58A,"Oxford Spiral Notebook 6 Pack, 1 Subject, College Ruled Paper, 8 x 10-1/2 Inch, Color Assortment Design May Vary (65007)",11.99,4.8 out of 5 stars,42678.0,6000.0,False,False,False,False,Oxford
B00P9U2EM8,"Mead Spiral Notebooks, 6 Pack, 1 Subject, College Ruled Paper, 7-1/2"" x 10-1/2"", 70 Sheets per Notebook, Color Will Vary (73065)",12.21,4.7 out of 5 stars,16143.0,10000.0,False,False,False,False,Mead
B01DN8TCEU,"Amazon Basics Classic Lined Notebook, 240 Pages Hardcover, 5 x 8.25-Inch, Black",6.39,4.7 out of 5 stars,46185.0,5000.0,False,False,False,False,Generic
B07L4JCG7T,"PAPERAGE Lined Journal Notebook, (Black), 160 Pages, Medium 5.7 inches x 8 inches - 100 GSM Thick Paper, Hardcover",9.95,4.7 out of 5 stars,56144.0,5000.0,True,False,False,False,PAPERAGE
B07YLTJHH4,"Amazon Basics Professional Journal, 10.5X7.5 inches, Black, 2-Pack",22.09,4.6 out of 5 stars,4283.0,2000.0,False,False,False,False,Generic
B0BWYLWWC1,ZICOTO Aesthetic Spiral Notebook Set of 3 For Women - Cute College Ruled 8x6 Journal/Notebook with Large Pockets And Lined Pages - Perfect Supplies to Stay Organized at Work or School,16.99,4.8 out of 5 stars,1179.0,4000.0,False,False,False,False,ZICOTO
B0B4DKQSDV,"Lined Journal Notebook for Women Men,256 Pages A5 Hardcover Leather Journals for Writing,Travel,Business,Work & School,College Ruled Notebooks for Note Taking,Diary Notepad 5.7""×8.3""(Brown)",9.99,4.7 out of 5 stars,3334.0,5000.0,False,False,False,False,Generic
8883701127,"Moleskine Classic Notebook, Large, Ruled, Black, Hard Cover (5 x 8.25)",16.75,4.7 out of 5 stars,46469.0,2000.0,False,False,False,True,Moleskine
B08NYRMWZ8,"Yansanido Spiral Notebook, 4 Pcs 8.3 Inch x 5.9 Inch A5 Thick Plastic Hardcover 8mm Ruled 4 Color 80 Sheets -160 Pages Journals for Study and Notes (style 10-Wine Red,Brown,Green,ivory, A5)",12.99,4.6 out of 5 stars,2263.0,2000.0,False,False,False,False,Yansanido
B0CWS3YSVG,"Five Star Spiral Notebook, 2 Subject, College Ruled, 9 1/2"" x 6"" 80 Sheets, Sedona Orange (840029CD1-ECM)",2.79,4.4 out of 5 stars,580.0,1000.0,False,False,False,False,Generic
B0028N6PSS,"Mead Composition Notebooks, 12 Pack, Wide Ruled Paper, 9-3/4"" x 7-1/2"", 100 Sheets per Comp Book, Black Marble (72936)",20.95,4.8 out of 5 stars,12354.0,900.0,True,False,False,False,Mead
B0CZ6PW951,"Lined Spiral Journal Notebook for Women, A5 College Ruled Journals for Writing, Hardcover Notebooks for Work, Note taking and Office School Supplies,140 Pages - Purple",5.94,4.7 out of 5 stars,335.0,4000.0,False,False,False,True,Generic
B07WFVVCLX,"Rocketbook Core Reusable Smart Notebook | Innovative, Eco-Friendly, Digitally Connected Notebook with Cloud Sharing Capabilities | Lined, 8.5"" x 11"", 36 Pg, Infinity Black",23.99,4.5 out of 5 stars,28604.0,1000.0,False,False,False,False,Rocketbook
B07DPLK7RL,"Five Star Spiral Notebook + Study App, 3 Subject, College Ruled Paper, Fights Ink Bleed, Water Resistant Cover, 8-1/2"" x 11"", 150 Sheets, Purple (38746)",4.78,4.8 out of 5 stars,8281.0,1000.0,False,False,False,False,Generic
B0B7DQ3R84,"Lined Journal Notebook, 200 Pages, Leather Hardcover Notebooks, A5 College Ruled Thick Classic with Pen Loop Notebook Journals for Writing, for Women Men Office School, 5.75'' X 8.38'', Brown",7.99,4.6 out of 5 stars,1373.0,3000.0,False,False,False,True,Generic
B08VF9B772,"Oxford Spiral Notebook, 1 Subject, College Ruled Paper, 8 x 10-1/2 Inch, Pastel Pink, Orange, Yellow, Green, Blue and Purple, 70 Sheets (63756), Set of 6",10.53,4.8 out of 5 stars,7306.0,3000.0,False,False,False,False,Oxford
B0CLVBLNQC,Aesthetic Thick Spiral Notebook Journal For Women in B5 Format - Modern Linen Hardcover College Ruled Note Book With 300 Lined Pages - Perfect For Writing And Staying Organized at Work or School,14.99,4.7 out of 5 stars,603.0,1000.0,False,False,False,False,Generic
B0CX1RDX77,"Lined Spiral Journal Notebook, A5 Hardcover Spiral Journals for Women Men, 150 Numbered Pages Spiral Bound Notebook, 100 GSM College Ruled Notebooks for Writing Note Taking 5.75"" x 8.38"", Olive Green",5.99,4.7 out of 5 stars,163.0,2000.0,False,False,False,False,Generic
B01E3UIR02,"Five Star Spiral Notebooks + Study App, 6 Pack, 1 Subject, Wide Ruled Paper, Fights Ink Bleed, Water Resistant Cover, 8-1/2"" x 10"", 100 Sheets, Black, Red, Yellow, Purple, Green, Blue (38042)",17.51,4.8 out of 5 stars,2285.0,600.0,False,False,False,False,Generic
B0CWS28VK1,"Five Star Spiral Notebooks + Study App, 4 Pack, 1 Subject, College Ruled Paper, 8-1/2"" x 11"", 100 Sheets, Purple, Pink, White, Green (820337-ECM)",14.99,4.8 out of 5 stars,305.0,2000.0,False,False,False,False,Generic
B00TES8E7U,"Maruman MNEMOSYNE Notebook 11.69 x 8.66 Inches (A4), 7mm ruled 36-line, 70 Sheets (N199A), white",18.26,4.8 out of 5 stars,333.0,200.0,False,False,False,False,Maruman
B09NS6VP4W,"SUIN Hardcover-Journal-Notebooks, 6 Packs A5 Lined Journals Notebook for Writing 200 Pages, 8.2 x 5.5 inch, 6 Colors Classic Ruled Notebooks for Work/Travel/College",36.99,4.7 out of 5 stars,1106.0,600.0,False,False,False,False,SUIN
B07CFN85RS,"Oxford Stone Paper Notebook, School Notebooks, Journal for Writing, 8-1/2"" x 11"", Blue Cover, 60 Sheets, 2 Pack (161646)",14.79,4.3 out of 5 stars,5997.0,400.0,False,False,False,False,Oxford
B08ZDNBX2P,"LEUCHTTURM1917 The Official Bullet Journal Edition 2 - Notebook Built for BuJo, Medium A5 204 Pages of 120gsm Paper, with Bujo Pocket Guide (Black)",30.24,4.8 out of 5 stars,1201.0,300.0,False,False,False,False,LEUCHTTURM1917
B0D5DFGNXZ,"Spiral Notebook - Lined Journal Notebooks, 8.3'' x 6'', Classic Notebook with Thick Paper",2.49,,,50.0,False,False,False,False,Generic
8883707168,"Moleskine Classic Notebook, Soft Cover, Large (5"" x 8.25"") Ruled/Lined, Black, 192 pages",10.11,4.7 out of 5 stars,26578.0,2000.0,False,False,False,True,Moleskine
B09FG45HFT,"Yansanido Spiral Notebook, 4 Pcs 8.3 Inch x 5.9 Inch A5 Thick Plastic Hardcover 7mm College Ruled 4 Color 80 Sheets -160 Pages Journals for Study and Notes (4)",9.99,4.6 out of 5 stars,2335.0,1000.0,False,False,False,False,Yansanido
B096WJ89YR,LEUCHTTURM1917-120G Special Edition - Medium A5 Ruled Hardcover Notebook (Black) - 203 Numbered Pages with 120gsm Paper,28.95,4.8 out of 5 stars,1663.0,100.0,False,False,False,False,LEUCHTTURM1917-120G
B09BBGMLK2,"PAPERAGE 6-Pack Composition Notebook Journals, 120 Pages, Kraft Cover with Jewel Tone Spines, College Ruled Lined Paper, Small Size (8 in x 5.75 in) – For Home, Office or School Supplies",15.95,4.6 out of 5 stars,2582.0,100.0,False,False,False,False,PAPERAGE
B079ZT467D,"Moleskine Cahier Journal, Soft Cover, XL (7.5"" x 9.5"") Dotted, Black, 120 Pages (Set of 3)",22.11,4.7 out of 5 stars,19074.0,50.0,False,False,False,True,Moleskine
B0C2H791FH,"Forvencer Lined Spiral Journal Notebook with 300 Numbered Pages, B5 College Ruled Thick Journals for Writing with 100GSM Paper, Hardcover Notebooks with Contents for Work, School, Women, Men, Black",14.99,4.8 out of 5 stars,1716.0,400.0,False,False,False,True,Forvencer
B0D2WKR2S8,Aesthetic Spiral Notebook Set of 2 For Women and Men - Cute College Ruled 8x6 Bible Study Journal/Notebook with Pockets And Lined Pages - Perfect A5 Supplies to Stay Organized at Work or School,7.99,4.6 out of 5 stars,98.0,1000.0,False,False,False,False,Generic
B018R4I7A0,"LEUCHTTURM1917 - Notebook Hardcover Medium A5-251 Numbered Pages for Writing and Journaling (Army, Dotted)",25.5,4.7 out of 5 stars,36631.0,200.0,False,False,False,True,LEUCHTTURM1917
B0C2PW1Z2B,Beautiful Daily Planner And Notebook With Hourly Schedule - Aesthetic Spiral To do List Notepad to Easily Organize Your Tasks And Appointments - Stylish Book And School Or Office Supplies For Women,13.99,4.8 out of 5 stars,568.0,600.0,False,False,False,False,Generic
B07RTZY71C,"PAPERAGE Lined Pocket Journal Notebook, 2 Pack, (Black), 160 Pages, Small Notebook, 3.6 inches x 5.6 inches - 100 gsm Thick Paper, Hardcover",9.95,4.7 out of 5 stars,6297.0,500.0,False,False,False,False,PAPERAGE
B0C21BWVTT,"HP 250 G9 15.6"" Notebook - Full HD - 1920 x 1080 - Intel Core i5 12th Gen i5-1235U Deca-core (10 Core) 1.30 GHz - 16 GB Total RAM - 512 GB SSD",470.0,5.0 out of 5 stars,2.0,50.0,False,False,False,False,HP
B000Q67J66,The Notebook,9.99,4.6 out of 5 stars,13550.0,,False,False,False,False,Generic
B0091GBD00,"Midori 15003006 MD Notebook, A5, Grid Ruled",14.99,4.8 out of 5 stars,3302.0,300.0,False,False,False,False,Midori
B0B975R4VK,"SUNEE 3 Pack Spiral Notebook - A5 Lined Journal Notebook, 120gsm Thick Paper, College Ruled, Giftable Journal for Study and Notes 80 Sheets, 5.7"" x 8.3"", Blue, Pink, Transparent",14.99,4.7 out of 5 stars,1646.0,50.0,False,False,False,False,SUNEE
B08Q7WHXC3,"EMSHOI Lined Journal Spiral Notebook 5.7"" x 8.22"" - 4 Pack 640 Pages 100gsm Thick Paper, A5 Small Notebooks College Ruled, Plastic Hardcover Journals for Writing Women Men Work School Supplies",16.99,4.6 out of 5 stars,771.0,200.0,False,False,False,False,EMSHOI
B07145M2T4,"Five Star Spiral Notebooks, 6 Pack, Fat Lil' Pocket Notebooks, College Ruled Paper, 3-1/2"" x 5-1/2"", Small, 200 Sheets, Purple, Orange, Green, Blue, Gray, Black (38027)",16.99,4.6 out of 5 stars,7459.0,700.0,False,False,False,False,Generic
B0CPHRF7WW,"Five Star Spiral Notebooks + Study App, 2 Pack, 1 Subject, College Ruled Paper, 11"" x 8-1/2"", 80 Sheets, Soft Petals (820331F-ECM)",11.55,4.7 out of 5 stars,187.0,300.0,False,False,False,False,Generic
B00I6XY068,MUJI Notebook B5 6mm Rule 30sheets - Pack of 5books [5colors Binding],9.49,4.8 out of 5 stars,1815.0,300.0,False,False,False,False,MUJI
B0D7GVVRRM,"Lined Spiral Notebook Journal for Work, 300 Pages Thick B5 (7.1""x10"") College Ruled Journal for Women & Writing, Hardcover Notebook for Note Taking, Perfect for Office Home School Supplies, Newest, Purple",9.99,4.7 out of 5 stars,60.0,1000.0,False,False,False,True,Generic
B0C5JCJ8JZ,"KOKUYO Campus Spiral Notebook, 10-1/2” x 8”, College Ruled, 80 Sheets (160 pages), Bleed Resistant, Pack of 3 Colors - Pink, Sky Blue, Green, Made in Japan (WSG-SU-400G1×3)",14.75,4.7 out of 5 stars,261.0,500.0,False,False,False,False,KOKUYO
B0DJSYVYDX,"ACEMAGIC 2024 Newest Gaming Laptop, 16.1-inch FHD Display Laptop with AMD Ryzen 7 5825U Processor(8C/16T), 16GB RAM 512GB ROM Laptop Computer, Support WiFi 6, 53Wh Battery, with Backlit Keyboard",599.99,4.4 out of 5 stars,28.0,400.0,False,False,False,False,ACEMAGIC
B0CRDCXRK2,"ASUS ROG Strix G16 (2024) Gaming Laptop, 16” 16:10 FHD 165Hz Display, NVIDIA® GeForce RTX™ 4060, Intel Core i7-13650HX, 16GB DDR5, 1TB PCIe Gen4 SSD, Wi-Fi 6E, Windows 11, G614JV-AS74",,4.3 out of 5 stars,1418.0,1000.0,False,False,False,False,ASUS
B0DKJM6L2L,"Gaming Laptop AMD Ryzen 7 5825U(8C/16T), Radeon RX Vega 8 Graphics,16.1“FHD Display,16GB DDR4 512GB NVMe SSD Laptop Computer with Backlit KB,Type_C (Full Function),WiFi 6, 53Wh Battery",599.99,5.0 out of 5 stars,2.0,,False,False,False,False,Generic
B0DFLKH5FK,"AOC Gaming Laptop, 16.1” FHD Display, AMD Ryzen 7 5825U Octa-Core CPU, 16GB RAM 512GB SSD, Windows 11 Laptop Computer, Wi-Fi 6, Backlit Keyboard, HDMI, USB3.2, Type-C, 53Wh Battery, Metal Shell",599.99,5.0 out of 5 stars,6.0,100.0,False,False,False,False,AOC
B0DFB87RLW,"ACEMAGIC 2024 Newest Gaming Laptop, 16.1-inch FHD Display Laptop with AMD Ryzen 7 5825U Processor(8C/16T) with Backlit Keyboard,16GB DDR4 512GB M.2 2280 NVMe SSD Laptop Computer,Type-C USB3.2",565.0,4.3 out of 5 stars,190.0,500.0,False,False,False,False,ACEMAGIC
B0DJT5KFGY,"ACEMAGIC Gaming Laptop AMD Ryzen 7 5825U Laptop 16GB DDR4 (2 * 8GB, Dual Channel) 512GB M.2 2280 NVMe SSD Windows Laptop 16.1-inch IPS WIFI6 Mini Laptop",599.99,5.0 out of 5 stars,8.0,,False,False,False,False,ACEMAGIC
B0D845LL5R,"HP Victus 15.6 i5 Gaming Laptop, 15.6"" FHD 1920*1080 144Hz, Intel Core i5-12450H, NVIDIA GeForce RTX 3050, 32GB RAM, 1TB SSD, Backlit KB, Touchpad, SD Card Reader, Webcam, HDMI, Wi-Fi 6, W11 H, Blue",660.0,4.2 out of 5 stars,20.0,400.0,False,False,False,False,HP
B0CXY573W9,"Acer Nitro V Gaming Laptop | AMD Ryzen 7 8845HS Octa-Core AI Capable Processor | NVIDIA GeForce RTX 4060 Laptop GPU | 16"" WUXGA IPS 165Hz Display | 16GB DDR5 | 1TB Gen 4 SSD | Wi-Fi 6E | ANV16-41-R5J0",954.99,4.3 out of 5 stars,458.0,500.0,False,False,False,False,Acer
B0CX27GY7N,"Acer Predator Helios Neo 16 Gaming Laptop | Intel Core i7-13650HX | NVIDIA GeForce RTX 4060 | 16"" WUXGA 1920 x 1200 165Hz G-SYNC Display | 16GB DDR5 | 512GB Gen 4 SSD | Killer Wi-Fi 6E | PHN16-71-76H5",999.99,4.5 out of 5 stars,1943.0,100.0,False,False,False,False,Acer
B0CP8D4SM2,"Acer Nitro V Gaming Laptop | Intel Core i5-13420H Processor | NVIDIA GeForce RTX 4050 Laptop GPU | 15.6"" FHD IPS 144Hz Display | 8GB DDR5 | 512GB Gen 4 SSD | WiFi 6 | Backlit KB | ANV15-51-51H9",741.5,4.4 out of 5 stars,1166.0,500.0,False,False,False,False,Acer
B0DHC8NZND,"Gaming Laptop, 15.6 Inch Laptops, Laptop Computer 16GB RAM 512GB SSD N5095 Laptops, 180 Angle Opening Fingerprint Unlock Backlit Keyboard, 1920X1080 FHD IPS WiFi MINI-HDMI For School Students Business",299.99,5.0 out of 5 stars,4.0,100.0,False,False,False,False,Generic
B0D33T6F9C,"MSI Thin 15 15.6” 144Hz FHD Gaming Laptop: Intel Core i5-12450H, NVIDIA Geforce RTX 2050, 16GB DDR5, 512GB NVMe SSD, Cooler Boost 5, Win 11: Black B13UCX-2041US",589.99,4.4 out of 5 stars,1894.0,100.0,False,False,False,False,MSI
B0D9LL87F4,"Lenovo Thinkbook 16 Ultra 7 155H Premium Laptop Computer Intel 16-Core 16"" FHD 32GB DDR5 1TB SSD Arc Graphics Backlit Keyboard Thunderbolt Win 11 Pro NPU AI Experience Copilot Business Laptop AZXUT",999.0,4.5 out of 5 stars,31.0,,False,False,False,False,Lenovo
B0DF2GQ7WF,"2 in 1 Laptop Touchscreen, 14 Inch Tablet Laptop Computer, Intel 12th Gen N100 Processor, 16GB DDR5 RAM, 512GB SSD, 1920 x 1200, Wi-Fi 6, BT5.2, Backlit Keyboard",439.99,4.0 out of 5 stars,14.0,,False,False,False,False,Generic
B0DFH33VKD,"AOC Newest 15.6"" Laptop, Intel Quad-Core Processor (Up to 3.6GHz), 16GB RAM, 512GB SSD, Windows 11 Laptops Computer, FHD Screen, Webcam, Light&Thin, Metal Shell, HDMI, Type-C, USB3.2 (2024 Flagship)",363.98,4.3 out of 5 stars,23.0,400.0,False,False,True,False,AOC
B0CWJZ8HRZ,"ASUS Vivobook S 14 OLED Laptop, Intel Core Ultra 9 185H, 16GB, 1TB SSD, Neutral Black, S5406MA-AS96, Intel Evo Edition",849.99,4.0 out of 5 stars,29.0,100.0,False,False,False,False,ASUS
B0C4YKD321,"2023 Model 15.6"" Full HD Windows 11 Home S Laptop - 8GB RAM 512GB SSD, AC WiFi, RJ45, Integrated Webcam - S15 N2 15 Inch Lightweight Laptop",199.99,3.7 out of 5 stars,1292.0,100.0,False,False,False,False,Generic
B0CQ3RRS23,"SAMSUNG 14"" Galaxy Book4 Pro Laptop PC Computer, Intel Core 7 Ultra Processor 512GB, 3K AMOLED (2880 x 1800) Touchscreen, Advanced Security, 2024 Model, NP940XGK-KG1US, Moonstone Gray",,3.8 out of 5 stars,26.0,50.0,False,False,False,False,SAMSUNG
B0BTQWR77M,"Acer Swift Go Intel Evo Thin & Light Premium Laptop 14"" 1920x1200 100% sRGB Touch Screen Display Intel Core i7-1355U Intel Iris Xe 16GB LPDDR5 512GB Gen 4 SSD SFG14-71T-72QV",599.99,4.2 out of 5 stars,300.0,100.0,False,False,False,False,Acer
B0CWJ642YM,"ASUS Vivobook 16” WUXGA Laptop, Intel Core i5-1235U, Intel Iris Xe Graphics, 16GB Memory, 512GB SSD, Cool Silver, F1605ZA-AS56",535.99,4.2 out of 5 stars,39.0,100.0,False,False,False,False,ASUS
B0CBD3P8LJ,"Lenovo ThinkPad X1 Carbon Gen 11 21HM000GUS 14"" Ultrabook - WUXGA - 1920 x 1200 - Intel Core i5 13th Gen i5-1335U Deca-core (10 Core) - Intel Evo Platform - 16 GB Total RAM - 16 GB On-Board Memory -",,,,,False,False,False,False,Lenovo
B0C8HZQK89,"ANTEMPER 14.1 Inch Windows 11 Laptop Computer, 256GB SSD 8GB RAM, Intel Celeron N4020C(up to 2.8GHz), Full HD 1920x1080 Laptops, Mini HDMI, USB3.0, Webcam, TF Card, Type-c, 5000mAh Battery, Gray",229.49,3.7 out of 5 stars,52.0,,False,False,False,False,ANTEMPER
B0CG2PZR8R,"Lenovo ThinkPad E16 Business Laptop, 16"" WUXGA Display, AMD Ryzen 5 7530U (Beat i7-1165G7), 24GB RAM, 1TB PCIe SSD, Webcam, HDMI, RJ-45, Fingerprint Reader, Wi-Fi 6, Windows 11 Pro, Black",679.0,4.2 out of 5 stars,125.0,100.0,False,False,False,False,Lenovo
B07YNK3H6P,"Microsoft Surface Laptop 3 – 13.5"" Touch-Screen – Intel Core i7 - 16GB Memory - 256GB Solid State Drive – Matte Black",799.0,4.4 out of 5 stars,557.0,,False,False,False,True,Microsoft
B093TK1PXF,"Acer Swift X SFX14-41G-R1S6 Creator Laptop | 14"" Full HD 100% sRGB | AMD Ryzen 7 5800U | NVIDIA RTX 3050Ti GPU | 16GB LPDDR4X | 512GB SSD | Wi-Fi 6 | Backlit KB | Amazon Alexa | Windows 10 Home",996.29,4.3 out of 5 stars,808.0,,False,False,False,True,Acer
B09TPTNZLG,"ASUS ZenBook Pro Duo 15 UX582 Laptop, 15.6” OLED 4K Touch Display, i7-12700H, 16GB, 1TB, GeForce RTX 3070 Ti, ScreenPad Plus, Windows 11 Home, Celestial Blue, UX582ZW-AB76T",,4.3 out of 5 stars,324.0,,False,False,False,False,ASUS
B0D3GWGB66,"HP Stream 14"" HD BrightView Laptop, Intel Celeron N4120, 16GB RAM, 256GB Storage (128GB eMMC + 128GB USB Card), Intel UHD Graphics, HD Camera, Fast Charge, 1 Year Office 365, Win 11 S, Gold",268.0,4.2 out of 5 stars,433.0,,False,False,False,False,HP
B0C4P29ZXH,"HP Premium Stream 14"" HD BrightView Laptop, Intel Celeron N4120, 16GB RAM, 64GB eMMC Storage, UHD Graphics, HD Webcam, 1 Year Office 365, Bluetooth, WiFi, HDMI, Win 11s, Pink, 32GB Hotface USB Card",309.0,4.3 out of 5 stars,314.0,50.0,False,False,False,False,HP
B0CKW2H77V,"8 Inch Mini Laptop HD Touchscreen Portable 2-in-1 Small Computer, Windows 11 Pro Laptop for Business and Students,Intel N100 12GB LPDDR5 512GB M.2 SSD,Wi-Fi 6,BT5.2,2MP Camera,G-Sensor,HDMI,Type C",419.0,3.8 out of 5 stars,101.0,,False,False,False,False,Generic
B0CNDX49H6,"acer Swift Go 14 Intel Evo Thin & Light Laptop | 14"" OLED 2880 x 1800 90Hz Display | Unlock AI Experiences | Intel Core Ultra 7 Processor 155H | Intel ARC | 16GB LPDDR5X | 1TB SSD | SFG14-72-72YK",799.99,4.0 out of 5 stars,75.0,,False,False,False,True,Generic
B0CFSBT85B,"HP Victus 15 Gaming Laptop, 15.6"" FHD 144Hz Display, AMD Ryzen 5 7535HS, 16GB DDR5 RAM, 512GB PCIe M.2 SSD, NVIDIA GeForce RTX 2050, HDMI, Webcam, Backlit Keyboard, Wi-Fi 6, Windows 11 Home, Silver",648.9,4.3 out of 5 stars,917.0,50.0,False,False,False,False,HP
B0D9NKTJYM,"OTVOC Laptop 16 inch Windows 11, 12th Gen N95, Up to 3.4GHz, 16GB DDR5 RAM, 1TB PCIE NVME SSD, 16"" FHD IPS 1920x1200, 2.0MP, 2.4G+5G WiFi, BT 5.0, HDMI, RJ45, Type C, Gray",359.99,5.0 out of 5 stars,5.0,,False,False,False,False,OTVOC
B09VTNKJWS,"Late 2019 Apple MacBook Pro with 2.6GHz Intel Core i7 (16 inch, 32GB RAM, 512GB SSD) Space Gray (Renewed)",599.99,4.0 out of 5 stars,51.0,,False,False,False,True,Generic
B082MRK1DB,"Mid 2018 Apple MacBook Pro Touch Bar with 2.7GHz Quad-Core Intel Core i7 (13.3 inches, 16GB RAM, 512GB SSD) Silver (Renewed)",487.5,4.6 out of 5 stars,8.0,,False,False,False,True,Generic
B0DHVRD4H3,ACEMAGIC Laptop Computer with Intel N95 Windows Laptop 16GB DDR4 512GB M.2 2280 SSD Traditional Laptops 15.6-inch IPS FHD Windows11 WIFI5 BT5.0 HDMI Type-C USB Home Laptops Office Laptops Mini Laptop,359.99,5.0 out of 5 stars,7.0,50.0,False,False,False,False,ACEMAGIC
B0DJLL26QB,"ACEMAGIC Laptop Computer, 16GB DDR4 512GB SSD, 15.6 Inch Windows 11 Laptop with Quad-Core N95(Up to 3.4GHz), Metal Shell, BT5.0, 5G WiFi, USB3.2, Type_C, Webcam, 38Wh Battery",359.99,4.6 out of 5 stars,19.0,200.0,False,False,False,False,ACEMAGIC
B0CBJ46QZX,"Newest Flagship Chromebook, 14'' FHD Touchscreen Slim Thin Light Laptop Computer, 8-Core MediaTek Kompanio 520 Processor, 4GB RAM, 64GB eMMC, WiFi 6,Chrome OS+HubxcelAccesory, Abyss Blue",206.99,4.3 out of 5 stars,497.0,2000.0,False,False,True,False,Lenovo
B0D33NC672,"Gateway Chromebook 311 CBO311-1H-C1MX Laptop | Intel Celeron N4500 | 11.6"" HD (1366 x 768) Display | 4GB LPDDR4X | 64GB eMMC | Wi-Fi 5 802.11ac | Chrome OS | Star Black",168.0,4.5 out of 5 stars,10268.0,1000.0,False,False,False,False,acer
B0CJS1399P,"Chromebook CM14 Laptop, 14"" HD Anti-Glare Display (1366x768), MediaTek Kompanio 520, 4GB RAM, 64GB eMMC, ChromeOS, Gray, CM1402CM2A-DS44, Gravity Grey",169.9,4.2 out of 5 stars,1095.0,500.0,False,False,False,False,ASUS
B0DCLJ9V2B,"Chromebook 2024 Newest 14"" Touchscreen Slim Laptop Business Student, 8-Core MediaTek Kompanio 520, 4GB RAM, 128GB Storage (64GB eMMC+64GB Card), WiFi 6, Long Battery, Chrome OS+MarxsolAccessory",208.0,4.6 out of 5 stars,8.0,300.0,False,False,False,False,Lenovo
