asin,title,price,rating,reviews,sold_past_month,is_bestseller,is_prime,is_amazon_choice,has_sustainability_features,brand
B091D8TKZH,K55 RGB PRO XT - Dynamic Per-Key RGB Backlighting - Six Macro Keys with Elgato Stream Deck Software Integration - IP42 Dust and Spill-Resistant - QWERTY US Layout - Black,69.99,4.6 out of 5 stars,2736.0,100.0,False,True,False,False,Corsair
B0CBHP4SWC,K70 MAX RGB Magnetic-Mechanical Wired Gaming Keyboard - Adjustable Actuation MGX Switches - Rapid Trigger Mode - PBT Double-Shot Keycaps - iCUE Compatible - QWERTY NA Layout - Black,174.99,4.5 out of 5 stars,115.0,200.0,False,True,False,False,Corsair
B0BBWJ6V1R,"K70 PRO RGB Optical-Mechanical Gaming Keyboard - OPX Linear Switches, PBT Double-Shot Keycaps, 8,000Hz Hyper-Polling, Magnetic Soft-Touch Palm Rest - NA Layout, QWERTY - White",119.99,4.6 out of 5 stars,241.0,100.0,False,True,False,False,Corsair
B0CG8M6L8G,K70 CORE RGB Mechanical Gaming Keyboard - Pre-lubricated Corsair MLX Red Linear Keyswitches - Sound Dampening - Media Control Dial - iCUE Compatible - QWERTY NA Layout - Black,68.21,4.4 out of 5 stars,1523.0,200.0,False,True,False,False,Corsair
B08WCB916J,Corsair K100 RGB Optical-Mechanical Gaming Keyboard - Corsair OPX RGB Keyswitches - AXON Hyper-Processing Technology for 4X Faster Throughput - 44-Zone RGB LightEdge (Renewed),129.99,4.5 out of 5 stars,293.0,50.0,False,True,False,True,Corsair
B0CLGWXRW9,K65 RGB Mini 60% Mechanical Gaming Keyboard - Cherry MX Brown Mechanical Keyswitches - Customizable Per-Key RGB Backlighting - Detachable USB Type-C Cable - QWERTY NA Layout - Black,86.65,4.5 out of 5 stars,58.0,100.0,False,True,False,False,Corsair
B0B99LCF7C,Corsair K70 RGB PRO Wired Mechanical Gaming Keyboard CH-9109414 -Cherry MX RGB Speed Switches: Linear and Rapid (Renewed),74.99,4.7 out of 5 stars,31.0,100.0,False,True,False,False,Corsair
B08W2DY46Q,"K70 RGB Tenkeyless Mechanical Gaming Keyboard - CHERRY MX SPEED Switches, Aluminum Frame, Per-Key RGB Backlighting, Detachable USB-C Cable",156.99,4.6 out of 5 stars,1384.0,50.0,False,True,False,False,Corsair
B0C4WTKHXX,Corsair K70 RGB TKL Champion Series Gaming Keyboard CH-911901A - OPX Switch (Renewed),74.99,4.3 out of 5 stars,26.0,,False,True,False,False,Corsair
B07TNRCM1Z,"K57 RGB Wireless Gaming Keyboard - <1ms response time with Slipstream Wireless - Connect with USB dongle, Bluetooth or wired - Individually Backlit RGB Keys, Black",109.99,4.4 out of 5 stars,2973.0,100.0,False,False,False,False,Corsair
B09C12L49Z,Huntsman V2 Optical Gaming Keyboard: Linear Optical Switches - 8000Hz Polling Rate - Doubleshot PBT Keycaps - Dedicated Media Keys & Dial - Ergonomic Wrist Rest - Snap Tap,159.99,4.5 out of 5 stars,2875.0,500.0,False,True,True,False,Razer
B09X6GJ691,Ornata V3 X Gaming Keyboard: Low Profile Keys - Silent Membrane Switches - Spill Resistant - Chroma RGB Lighting - Ergonomic Wrist Rest - Snap Tap,34.98,4.4 out of 5 stars,2054.0,1000.0,False,True,False,True,Razer
B0C8QYB8W6,BlackWidow V4 X Mechanical Gaming Keyboard: Yellow Switches Linear & Silent - 6 Macro Keys - Chroma RGB - Doubleshot ABS Keycaps - Roller & Media Keys - Snap Tap,129.99,3.8 out of 5 stars,997.0,200.0,False,True,False,False,Razer
B08BFF4C7J,Huntsman Mini 60% Gaming Keyboard: Fast Keyboard Switches - Clicky Optical Switches - Chroma RGB Lighting - PBT Keycaps - Onboard Memory - Snap Tap - Black,99.99,4.7 out of 5 stars,13002.0,500.0,False,True,False,True,Razer
B09698GFZJ,BlackWidow V3 TKL Mechanical Gaming Keyboard: Yellow Mechanical Switches Linear & Silent - Chroma RGB - Compact Form Factor - Programmable Macros - Snap Tap,79.99,4.5 out of 5 stars,969.0,200.0,False,True,False,False,Razer
B08FQTGFT5,BlackWidow V3 Mechanical Gaming Keyboard: Green Mechanical Switches - Tactile & Clicky - Chroma RGB Lighting - Compact Form Factor - Programmable Macro Functionality - Quartz,103.99,4.7 out of 5 stars,4492.0,300.0,False,True,False,True,Razer
B0CG7FQML2,Huntsman V3 Pro Esports Gaming Keyboard: Analog Optical Switches - Razer Snap Tap - Rapid Trigger - Adjustable Actuation - Media Keys & Dial - Doubleshot PBT Keycaps - Wrist Rest - Black,233.57,4.2 out of 5 stars,320.0,200.0,False,True,False,True,Razer
B0935HWL1Z,BlackWidow V3 Mini HyperSpeed 65% Wireless Mechanical Gaming Keyboard: Green Mechanical Switches Tactile & Clicky - Doubleshot ABS Keycaps - Chroma RGB - Up to 200 Hr Battery - Snap Tap,93.98,4.3 out of 5 stars,1681.0,100.0,False,True,False,False,Razer
B0BBZLW22X,Razer Ornata V3 Gaming Keyboard: Low-Profile Keys - Mecha-Membrane Switches - UV-Coated Keycaps,39.95,4.2 out of 5 stars,178.0,50.0,False,True,False,False,Razer
B0C41FL318,Razer BlackWidow V4 Pro Wired Mechanical Gaming Keyboard: Green Mechanical Switches Tactile & Clicky - Doubleshot ABS Keycaps - Command Dial - Programmable Macros - Chroma RGB - Magnetic Wrist Rest,149.99,3.7 out of 5 stars,75.0,50.0,False,True,False,False,Razer
B08M38ZWPS,Razer BlackWidow V3 Mechanical Gaming Keyboard: Green Mechanical Switches - Tactile & Clicky - Chroma RGB Lighting - Compact Form Factor - Programmable Macro Functionality - USB Passthrough (Renewed),79.99,4.6 out of 5 stars,548.0,100.0,False,False,False,True,Razer
B0DD5S8TM8,Razer BlackWidow V4 Pro 75% Wireless Gaming Keyboard: OLED Display - True 4K Hz Wireless - Bluetooth - Hot Swappable - Orange Tactile Switches - Command Dial - Snap Tap - Chroma RGB - Wrist Rest,299.99,4.4 out of 5 stars,30.0,,False,True,False,False,Razer
B07JGDDWDN,BlackWidow Lite TKL Tenkeyless Mechanical Keyboard : Orange Key Switches - Tactile & Silent - White Individual Key Lighting - Compact Design - Detachable Cable - Classic Black,49.95,4.5 out of 5 stars,5871.0,100.0,False,True,False,False,Razer
B09J72K6SM,"Pro Type Ultra Wireless Mechanical Keyboard: Silent, Linear Switches - Ergonomic Design - HyperSpeed Technology - Connect up to 4 Devices - Fully Programmable Keys & Smart Controls",159.99,4.2 out of 5 stars,429.0,100.0,False,True,False,False,Razer
B07754PYFK,Tartarus V2 Gaming Keypad: Mecha Membrane Key Switches - One Handed Keyboard - 32 Programmable Keys - Customizable Chroma RGB Lighting - Programmable Macros - Snap Tap - Black,69.77,4.4 out of 5 stars,15999.0,1000.0,False,True,False,True,Razer
B09LX248LD,"Razer Huntsman V2 Optical Gaming Keyboard: Fastest Clicky Optical Switches w/Quick Keystrokes - Doubleshot PBT Keycaps - Dedicated Media Keys & Dial - Ergonomic (Renewed), Black",99.99,4.3 out of 5 stars,99.0,50.0,False,True,False,False,Razer
B004YAVF8I,"Logitech M185 Wireless Mouse, 2.4GHz with USB Mini Receiver, 12-Month Battery Life, 1000 DPI Optical Tracking, Ambidextrous PC/Mac/Laptop - Swift Grey",13.98,4.5 out of 5 stars,33801.0,10000.0,False,True,True,True,Logitech
B09HM94VDS,"Logitech MX Master 3S - Wireless Performance Mouse, Ergo, 8K DPI, Track on Glass, Quiet Clicks, USB-C, Bluetooth, Windows, Linux, Chrome - Graphite - With Free Adobe Creative Cloud Subscription",99.99,4.6 out of 5 stars,6594.0,10000.0,False,True,False,True,Logitech
B087Z5WDJ2,Logitech M510 Wireless Computer Mouse for PC with USB Unifying Receiver - Graphite,27.99,4.6 out of 5 stars,31032.0,10000.0,False,True,False,True,Logitech
B09BRD98T4,"Apple Magic Mouse: Wireless, Bluetooth, Rechargeable. Works with Mac or iPad; Multi-Touch Surface - White",67.98,4.6 out of 5 stars,17745.0,10000.0,False,True,False,False,Apple
B07CMS5Q6P,"Logitech G305 LIGHTSPEED Wireless Gaming Mouse, Hero 12K Sensor, 12,000 DPI, Lightweight, 6 Programmable Buttons, 250h Battery Life, On-Board Memory, PC/Mac - Black",30.39,4.6 out of 5 stars,31375.0,10000.0,True,True,False,True,Logitech
B087LXCTFJ,"Logitech G PRO X SUPERLIGHT Wireless Gaming Mouse, Ultra-Lightweight, HERO 25K Sensor, 25,600 DPI, 5 Programmable Buttons, Long Battery Life, Compatible with PC / Mac - Black",88.48,4.6 out of 5 stars,7550.0,5000.0,False,True,False,True,Logitech
B07FNJB8TT,"Logitech MX Vertical Wireless Mouse – Ergonomic Design Reduces Muscle Strain, Move Content Between 3 Windows and Apple Computers, Rechargeable, Graphite",76.1,4.4 out of 5 stars,13604.0,6000.0,False,True,False,True,Logitech
B005EJH6RW,"Amazon Basics Responsive and Precise 3-Button Wired USB Computer Mouse with Scrolling and Tracking, Single, Black",7.19,4.6 out of 5 stars,84472.0,10000.0,False,True,False,False,Generic
B0787D6SGQ,"Amazon Basics Ergonomic 2.4 GHz Wireless Optical Mouse, DPI adjustable, Compatible with PC, Mac, Laptop - Black",8.09,4.3 out of 5 stars,24775.0,10000.0,False,True,False,False,Generic
B098S48QWM,"VssoPlor Wireless Mouse, 2.4G Slim Portable Computer Mice with Nano Receiver for Notebook, PC, Laptop, Computer (Black and Gold)",7.98,4.6 out of 5 stars,22384.0,10000.0,False,True,False,True,VssoPlor
B07GBZ4Q68,"Logitech G502 HERO High Performance Wired Gaming Mouse, HERO 25K Sensor, 25,600 DPI, RGB, Adjustable Weights, 11 Programmable Buttons, On-Board Memory, PC / Mac",37.04,4.7 out of 5 stars,53183.0,9000.0,False,True,False,True,Logitech
B087Z6LSHW,"Logitech M720 Triathlon Multi-Device Wireless Mouse, Bluetooth, USB Unifying Receiver, 1000 DPI, 8 Buttons, 2-Year Battery, Compatible with Laptop, PC, Mac, iPadOS - Black",38.98,4.5 out of 5 stars,22540.0,9000.0,False,True,False,True,Logitech
B005EJH6Z4,"Amazon Basics 2.4 Ghz Wireless Optical Computer Mouse with USB Nano Receiver, Black",9.72,4.5 out of 5 stars,57568.0,10000.0,False,True,False,False,Generic
B094PS5RZQ,Razer DeathAdder Essential Gaming Mouse: 6400 DPI Optical Sensor - 5 Programmable Buttons - Mechanical Switches - Rubber Side Grips - Classic Black,20.98,4.4 out of 5 stars,11995.0,4000.0,False,True,False,True,Razer
B094QH5MWN,"E-YOOSO Wireless Mouse, Computer Mouse 18 Months Battery Life Cordless Mouse, 5 Level 4800 DPI, 6 Button Ergo Wireless Mice, 2.4G Portable USB Wireless Mouse for Laptop, Mac, Chromebook, PC, Windows",9.98,4.4 out of 5 stars,7435.0,4000.0,False,True,False,False,E-YOOSO
B09NBWL8J5,"Logitech G PRO X SUPERLIGHT 2 LIGHTSPEED Wireless Gaming Mouse, 8K Polling, Lightweight, LIGHTFORCE Hybrid Switches, HERO 2 Sensor, 888 IPS, 44,000 DPI, 5 Programmable Buttons,USB-C Charging, PC & Mac",122.54,4.5 out of 5 stars,963.0,2000.0,False,True,False,True,Logitech
B00ADBY98A,"Logitech M317 Wireless Mouse, 2.4 GHz with USB Receiver, 1000 DPI Optical Tracking, 12 Month Battery, Compatible with PC, Mac, Laptop, Chromebook - Blue",19.99,4.6 out of 5 stars,8578.0,4000.0,False,True,False,True,Logitech
B09JG4KJN5,"Wireless Mouse, D-09 Computer Mouse USB Cordless Mice for Laptop, Ergo Grips, Lightspeed 5-Level 2400 DPI, 16 Months Battery, Portable for PC Mac Chromebook (Black)",11.99,4.4 out of 5 stars,10118.0,6000.0,False,True,False,False,Generic
B001DHECXA,"TECKNET Wireless Mouse, 2.4G USB Computer Mouse with 6-Level Adjustable 4800 DPI, 30 Months Battery, Ergonomic Grips, 6 Buttons Portable for PC, Chromebook, Mac - Grey",8.99,4.4 out of 5 stars,51965.0,5000.0,False,True,False,False,TECKNET
B073319ZJF,"Rii Wireless Mouse, 2.4G Portable Computer Mice for PC, Laptop, Windows,Office Included Wireless USB dongle (Black)",5.49,4.2 out of 5 stars,12309.0,4000.0,False,True,False,False,Rii
B087Z733CM,"Logitech M705 Marathon Wireless Mouse, 2.4 GHz USB Unifying Receiver, 1000 DPI, 5-Programmable Buttons, 3-Year Battery, Compatible with PC, Mac, Laptop, Chromebook - Black",29.99,4.5 out of 5 stars,22540.0,8000.0,False,True,False,True,Logitech
B0BXNR9DB6,"Logitech M240 Silent Bluetooth Mouse, Wireless, Compact, Portable, Smooth Tracking, 18-Month Battery, for Windows, macOS, ChromeOS, Compatible with PC, Mac, Laptop, Tablets - Graphite",14.99,4.5 out of 5 stars,33801.0,10000.0,False,True,True,True,Logitech
B0D9N7RY1D,"Logitech M196 Bluetooth Wireless Mouse, Compact and Portable Mouse for Laptops, Tablets and More, 12-Month Battery, Smooth Tracking, Compatible with PC and Mac, Windows and macOS - Graphite",12.99,4.5 out of 5 stars,62.0,3000.0,False,True,True,False,Logitech
B07C2NL5HK,"TECKNET Bluetooth Mouse, 4800 DPI Computer Mouse, 2-Year Battery Wireless Mouse 6 Adjustable DPI, 6 Buttons Compatible with Laptop/Windows/Computer",13.99,4.3 out of 5 stars,18485.0,4000.0,False,True,False,False,TECKNET
B07KNQRQ3P,"ZERU Bluetooth Mouse,Rechargeable Wireless Mouse for Macbook Pro/Macbook Air,Bluetooth Wireless Mouse for Laptop/PC/Mac/iPad pro/Computer",10.79,4.3 out of 5 stars,27658.0,3000.0,False,True,False,False,ZERU
B0CPSP33T8,"Logitech Signature M550 L Full Size Wireless Mouse - for Large Sized Hands, 2-Year Battery, Silent Clicks, Bluetooth, Multi-Device Compatibility - Black",24.99,4.5 out of 5 stars,1167.0,2000.0,False,True,False,False,Logitech
B082V7PWD1,"TECKNET Bluetooth Mouse, 4000DPI Wireless Mouse Bluetooth for Laptop 2-in-1(BT 5.0/3.0+2.4Ghz) Computer Mouse, Portable PC Mouse Wireless with USB Receiver for Mac, Compatible with MacBook Chromebook",10.98,4.4 out of 5 stars,8310.0,4000.0,False,True,False,False,TECKNET
B0BPCW5CS6,Wireless Bluetooth Mouse Rechargeable LED Silent Slim Laptop Mouse Portable(Bluetooth5.2 and 2.4GHz USB Receiver) Dual Mode Computer Mouse for Laptop/iPad Tablet/Apple Computer/MacBook (Black),6.98,4.2 out of 5 stars,5337.0,4000.0,False,True,False,False,Generic
B0D9FBMGQY,"Logitech Pebble Wireless Mouse with Bluetooth or 2.4 GHz Receiver, Silent, Slim Computer Mouse with Quiet Clicks, for Laptop/Notebook/iPad/PC/Mac/Chromebook - Graphite",19.99,4.7 out of 5 stars,10825.0,1000.0,False,True,False,False,Logitech
B0CP3HTHLZ,"TECKNET Wireless Mouse (BT5.0/3.0 & 2.4G) Rechargeable 4800 DPI Silent Mouse 6 Buttons Bluetooth Mouse, USB A Mouse Wide Compatibility - Grey",16.99,4.5 out of 5 stars,11453.0,4000.0,False,True,False,False,TECKNET
B09J1TB35S,"Logitech Lift Vertical Ergonomic Mouse, Wireless, Bluetooth or Logi Bolt USB receiver, Quiet clicks, 4 buttons, compatible with Windows/macOS/iPadOS, Laptop, PC - Graphite",69.99,4.6 out of 5 stars,9663.0,4000.0,False,False,False,True,Logitech
B0C4XXH2FV,"Logitech MX Master 2S Bluetooth Edition Wireless Mouse – Use on Any Surface, Hyper-Fast Scrolling, Ergonomic, Rechargeable, Control Up to 3 Apple Mac and Windows Computers - Graphite",68.47,4.4 out of 5 stars,533.0,3000.0,False,True,False,False,Logitech
B0CHRS6H8D,"Nulea Wireless Bluetooth Mouse, Dual Mode Connectivity (Bluetooth 5.0 & 2.4G USB) Computer Mouse, Sleek, Portable, Compact Design in 10 Colors for iPad, Laptop & PC Use (Black)",7.99,4.5 out of 5 stars,1902.0,1000.0,False,True,False,True,Nulea
B09KX9P829,"Logitech Signature M650 L Full Size Wireless Mouse - For Large Sized Hands, 2-Year Battery, Silent Clicks, Customizable Side Buttons, Bluetooth, for PC/Mac/Multi-Device/Chromebook - Black",35.99,4.6 out of 5 stars,9187.0,4000.0,False,True,False,True,Logitech
B07GCKQD77,"Logitech G Pro Wireless Gaming Mouse with Esports Grade Performance, Black",58.89,4.6 out of 5 stars,12542.0,5000.0,False,True,False,True,Logitech
B094Q1GJSD,Razer DeathAdder Essential Gaming Mouse: 6400 DPI Optical Sensor - 5 Programmable Buttons - Mechanical Switches - Rubber Side Grips - Mercury White,22.04,4.4 out of 5 stars,11995.0,3000.0,False,True,False,True,Razer
B08SJ5Z8JL,"Redragon M612 Predator RGB Gaming Mouse, 8000 DPI Wired Optical Gamer Mouse with 11 Programmable Buttons & 5 Backlit Modes, Software Supports DIY Keybinds Rapid Fire Button",19.99,4.6 out of 5 stars,5086.0,5000.0,False,True,False,True,Redragon
B07YN82X3B,"Logitech G203 Wired Gaming Mouse, 8,000 DPI, Rainbow Optical Effect LIGHTSYNC RGB, 6 Programmable Buttons, On-Board Memory, Screen Mapping, PC/Mac Computer and Laptop Compatible - Black",19.99,4.6 out of 5 stars,17241.0,2000.0,False,True,False,True,Logitech
B09C13PZX7,Razer Basilisk V3 Customizable Ergonomic Gaming Mouse: Fastest Gaming Mouse Switch - Chroma RGB Lighting - 26K DPI Optical Sensor - 11 Programmable Buttons - HyperScroll Tilt Wheel - Classic Black,44.0,4.6 out of 5 stars,7144.0,4000.0,False,True,False,True,Razer
B0943HXDVM,"Logitech G502 X Wired Gaming Mouse - LIGHTFORCE hybrid optical-mechanical primary switches, HERO 25K gaming sensor, compatible with PC - macOS/Windows - Black",47.49,4.4 out of 5 stars,1337.0,2000.0,False,True,False,True,Logitech
B07NSSPV9S,"Logitech G703 Lightspeed Wireless Gaming Mouse W/Hero 25K Sensor, PowerPlay Compatible, Lightsync RGB, Lightweight 95G+10G Optional, 100-25, 600 DPI, Rubber Side Grips - Black",49.39,4.5 out of 5 stars,7104.0,1000.0,False,True,False,True,Logitech
B00Z9V0NKC,"BENGOO Gaming Mouse Wired, Ergonomic Gamer Laptop PC Optical Computer Mice with RGB Backlit, 4 Adjustable DPI Up to 3600, 6 Programmable Buttons for Windows 7/8/10/XP Vista Linux -Black",9.0,4.6 out of 5 stars,12914.0,2000.0,True,True,False,False,BENGOO
B09VPBF8NY,"Redragon M656 Gainer Wireless Gaming Mouse, 4000 DPI 2.4Ghz Gamer Mouse w/ 5 DPI Levels, 7 Macro Buttons, Red LED Backlit & Pro Software/Drive Supported, for PC/Mac/Laptop",19.99,4.5 out of 5 stars,1229.0,1000.0,False,True,False,True,Redragon
B0B66RHD7B,"Redragon Gaming Mouse, Wireless Mouse Gaming with 8000 DPI, PC Gaming Mice with Fire Button, RGB Backlit Programmable Ergonomic Mouse Gamer, Rechargeable, 70Hrs for Windows, Mac Gamer, Black",29.99,4.4 out of 5 stars,3395.0,1000.0,False,True,False,True,Redragon
B08VTS4T4B,"EVGA X17 Gaming Mouse, Wired, Black, Customizable, 16,000 DPI, 5 Profiles, 10 Buttons, Ergonomic 903-W1-17BK-KR",14.99,4.2 out of 5 stars,1630.0,500.0,False,True,False,False,EVGA
B00BIFNTMC,"Anker 2.4G Wireless Vertical Ergonomic Optical Mouse, 800 / 1200 /1600 DPI, 5 Buttons for Laptop, Desktop, PC, Macbook - Black",25.99,4.2 out of 5 stars,50519.0,5000.0,False,True,False,True,Anker
B098HXFLMW,"Logitech Lift Vertical Ergonomic optical Mouse, Wireless, Bluetooth or Logi Bolt USB receiver, Quiet clicks, 4 buttons, compatible with Windows/macOS/iPadOS, Laptop, PC - Rose",69.99,4.6 out of 5 stars,9663.0,2000.0,False,True,True,True,Logitech
B08TLYK78K,"Logitech M575 Ergonomic Wireless Trackball USB Mouse, Black (910-005869)",39.0,4.6 out of 5 stars,5591.0,5000.0,False,True,False,False,Logitech
B07BFCVJZC,"Lekvey Ergonomic Mouse, Vertical Wireless Mouse - Rechargeable 2.4GHz Optical Vertical Mice : 3 Adjustable DPI 800/1200/1600 Levels 6 Buttons, for Laptop, PC, Computer, Desktop, Notebook etc, Black",24.99,4.3 out of 5 stars,14212.0,4000.0,False,True,False,False,Lekvey
B0CW6F9W2K,"Bluetooth and 2.4G (2-in-1) Rechargeable Wireless Mouse, Ergonomic Vertical Design, 1000/1200/1600 DPI, 6 Silent Buttons, for Laptop, Computer, PC, MacBook, Chromebook-Black",9.99,4.4 out of 5 stars,558.0,2000.0,False,True,False,False,Generic
B0D1Y3KSHW,"TECKNET Ergonomic Mouse, 4800 DPI Wireless Vertical Mouse, 5 Adjustable DPI Levels, 6 Buttons, 2.4G Silent Wireless Mouse for Laptop, PC, Chromebook, Mac - Black",19.99,4.4 out of 5 stars,2346.0,1000.0,False,True,False,False,TECKNET
B0CX18LHWS,"ProtoArc Ergonomic Vertical Mouse, EM11 NL Bluetooth Mouse Wireless, Ergo Mouse with 3 Multi-Device for PC/Notebook/Laptop, USB Rechargeable Mice for Windows, Mac OS, Black",26.99,4.4 out of 5 stars,750.0,3000.0,False,True,False,True,ProtoArc
B09HHHDZZG,"Nulea M501 Wireless Trackball Mouse, Rechargeable Ergonomic, Easy Thumb Control, Precise & Smooth Tracking, 3 Device Connection (Bluetooth or USB Receiver), Compatible for PC, Laptop, Mac, Windows.",29.99,4.4 out of 5 stars,10025.0,3000.0,True,True,False,True,Nulea
B0CCXJB1JG,"Lekvey Ergonomic Mouse, Vertical Wireless Mouse Rechargeable 2.4 GHz Optical Carpal Tunnel Mouse : 800/1200 / 1600 DPI, 6 Buttons, for Laptop, PC, Computer, Desktop, Notebook etc, Green Purple",24.99,4.3 out of 5 stars,874.0,1000.0,False,True,False,False,Lekvey
B0CT2C56BB,"seenda Ergonomic Mouse Rechargeable, Vertical Wireless Mouse with Volume knob, Quiet clicks, 3 Device Connection (Bluetooth or USB), Optical Mice for Windows, PC/Mac- Purple",25.99,4.7 out of 5 stars,99.0,400.0,False,True,False,False,seenda
B00FPAVUHC,"Anker Ergonomic Optical USB Wired Vertical Mouse 1000/1600 DPI, 5 Buttons CE100",22.99,4.4 out of 5 stars,8509.0,1000.0,False,True,False,True,Anker
B0D9HCM4XR,"Ergonomic Mouse Wireless Bluetooth Vertical Mouse Three-mode Connection:BT5.0+USB A+USB C- Rechargeable,Ergonomic,6 Buttons,1600 DPI,2.4G Optical-Compatible with Mac ipad Tablet Laptop PC Computer",19.99,4.4 out of 5 stars,476.0,500.0,False,True,False,False,Generic
B003L62T7W,"Logitech B100 Corded Mouse, Wired USB Mouse for Computers and Laptops, Right or Left Hand Use - Black",7.99,4.6 out of 5 stars,39333.0,10000.0,False,True,True,True,Logitech
B07K9DBY6N,"Logitech B100 Optical USB Mouse,Black",7.86,4.6 out of 5 stars,315.0,400.0,False,True,False,True,Logitech
B012DT5U96,Dell Optical Mouse MS116 (275-BBCB),7.99,4.6 out of 5 stars,14233.0,500.0,False,True,False,False,Dell
B01BC4TXXC,"TECKNET USB Wired Mouse, 6-Button Corded Mouse with 4 Adjustable DPI, Optical Computer Mouse with Ergonomic Design and 5FT Cord for Laptop, Chromebook, PC, Desktop, Mac, Notebook-Gray",9.99,4.5 out of 5 stars,11494.0,5000.0,False,True,False,False,TECKNET
B08VJDGK2H,"HP X500 - Wired USB Mouse for Windows PC Desktop, Laptop, Notebook, Mac, computerand Chromebook, for Righty or Lefty Use (E5E76AA#ABA),Black",7.99,4.7 out of 5 stars,3171.0,1000.0,False,True,False,False,HP
B01JPOLKDW,"Logitech M330 SILENT Wireless Mouse, 2.4GHz with USB Nano Receiver, 1000 DPI Optical Tracking, 2-year Battery Life, Compatible with PC, Mac, Laptop, Chromebook - Black",19.99,4.6 out of 5 stars,22255.0,5000.0,False,True,False,True,Logitech
B0BXYV1SZQ,"Lenovo 100 Wired USB Computer Mouse for PC, Laptop, Computer with Windows - Full-Size - Ambidextrous Design - 3 Buttons - Red Optical Sensor – Black",7.99,4.5 out of 5 stars,29658.0,1000.0,False,True,False,False,Lenovo
B09Y8K2HJN,"HP Wireless Mouse - Black, 15-Month Battery, 1600 DPI Sensor, Side Grips - for PC/Laptop, Mac, Chromebook",13.99,4.6 out of 5 stars,28040.0,4000.0,False,True,False,False,HP
B0877DK2FL,"Logitech ERGO M575 Wireless Trackball Mouse - Easy thumb control, precision and smooth tracking, ergonomic comfort design, for Windows, PC and Mac with Bluetooth and USB capabilities - Graphite",42.99,4.6 out of 5 stars,13226.0,2000.0,False,True,True,True,Logitech
B0753P1GTS,"Logitech MX Ergo Wireless Trackball Mouse, Ergonomic Design, Move Content Between 2 Windows and Apple Mac Computers (Bluetooth or USB), Rechargeable",83.32,4.5 out of 5 stars,12010.0,1000.0,False,True,False,True,Logitech
B07YVMXLQC,"Kensington Orbit Trackball Mouse with Scroll Ring (K75327WW), Black-Grey",31.23,4.3 out of 5 stars,7236.0,400.0,False,True,False,False,Kensington
B0CWTY6Z99,"ProtoArc Wireless Trackball Mouse, EM01 NL Ergonomic Bluetooth Rollerball Thumb Mouse Rechargeable Computer Laptop Mouse, Adjustable Angle & 3 Device Connection for PC, Mac, Windows-Gray Ball",39.99,4.3 out of 5 stars,816.0,1000.0,False,True,False,True,ProtoArc
B0BKLGJPQT,"Nulea Wireless Ergonomic Trackball Mouse, Rechargeable, Bluetooth Rollerball Mouse, 44mm Index Finger Trackball, 5 Adjustable DPI, Compatible with PC, Laptop, Mac",36.99,4.4 out of 5 stars,1461.0,500.0,False,True,False,True,Nulea
B01936N73I,"Kensington Expert Wireless Trackball Mouse (K72359WW) Black, 3.5"" x 6.1"" x 8""",75.29,4.3 out of 5 stars,9121.0,500.0,False,False,False,False,Kensington
B000HEW0KW,"Kensington Orbit Trackball Mouse (K64327F), Silver/Black",25.39,4.2 out of 5 stars,4485.0,500.0,False,True,False,False,Kensington
B0BLRQ4116,"Kensington SlimBlade™ Pro Wireless Trackball, Rechargeable Battery, Bluetooth 2.4GHz Connection Options (K72080WW)",99.99,4.4 out of 5 stars,431.0,500.0,False,True,False,False,Kensington
B09489Q3VY,"Logitech Ergo M575 Wireless Trackball Mouse, Easy Thumb Control, Precision and Smooth Tracking, Ergonomic Comfort Design, Windows/Mac, Bluetooth, USB - Graphite (Renewed)",32.73,4.5 out of 5 stars,610.0,300.0,False,True,False,True,Logitech
B0D7Q37FD1,"ProtoArc Vertical Wireless Trackball Mouse, EM05 NL Bluetooth Ergonomic Rollerball Mouse Rechargeable Computer Laptop Thumb Mouse, 3 Device Connection, Compatible with iPad, Mac, Windows, PC-Gray",59.99,4.4 out of 5 stars,270.0,200.0,False,True,False,True,ProtoArc
B0CD7G17C8,"ProtoArc Wireless Bluetooth Trackball Mouse, EM01 2.4G RGB Ergonomic Rechargeable Rollerball Mouse with 3 Adjustable DPI, 3 Device Connection for PC, iPad, Mac, Windows-Purple Ball",52.99,4.3 out of 5 stars,388.0,300.0,False,True,False,True,ProtoArc
B0BR7KX422,"Nulea M505B Wireless Trackball Mouse, Rechargeable Ergonomic RGB Rollerball Mouse, Easy Index Finger Control with 5 Adjustable DPI, 3 Device Connection for PC, Laptop, iPad, Mac, Windows, Android",37.99,4.4 out of 5 stars,442.0,200.0,False,True,False,True,Nulea
B0050SPZMK,"Kensington Orbit Wireless Trackball Mouse with Touch Scroll Ring (K72352US),Black",46.44,4.2 out of 5 stars,3694.0,100.0,False,True,False,False,Kensington
B0CMQJKT3G,"ProtoArc Wired Trackball Mouse, EM04 Wired USB C Ergonomic Rollerball Mouse Computer Laptop Mouse, Smooth Tracking, Thumb Control, Compatible with PC, Mac, Windows-Purple Ball",19.98,4.2 out of 5 stars,294.0,50.0,False,True,False,False,ProtoArc
B0BYD5H31D,"Wireless Bluetooth Mouse, Rechargeable LED Dual Mode Mouse (Bluetooth 5.2 and USB Receiver) Portable Silent Mouse,for Laptop/Desktop/Tablet (Black)",6.63,4.3 out of 5 stars,2994.0,1000.0,False,True,False,False,Generic
B08P6FXKP9,"Amazon Basics 3-Button USB Wired Mouse - Standard, Black",6.79,4.5 out of 5 stars,1679.0,500.0,False,True,False,False,Generic
B0D9FCG4GN,"Logitech M500s Advanced Corded Mouse with Advanced Hyper-Fast Scrolling & Tilt, Customizable Buttons, High Precision Tracking with DPI Switch, USB Plug & Play",29.99,4.3 out of 5 stars,1851.0,1000.0,False,True,False,False,Logitech
B0BJ6NBYJG,"TECKNET Wireless Mouse for Laptop, 2.4G Quiet Computer Mouse with USB Receiver, 4 Buttons Portable Cordless Mice for Chromebook, Laptop, PC, Mac, 800/1200/1600 DPI - Mint Green",7.99,4.5 out of 5 stars,9146.0,2000.0,False,True,False,False,TECKNET
